weber2021amplifying	weber	amplifying	Amplifying influence through coordinated behaviour in social networks	Derek Weber Frank Neumann	https://doi.org/10.1007/s13278-021-00815-2	2	2021	1	ira-2018 weber-2020				TRUE	0.91	1	1	0.91										
mesnards2018detecting	mesnards	detecting	Detecting Bots and Assessing Their Impact in Social Networks	Nicolas Guenon des Mesnards, David Scott Hunter, Zakaria el Hjouji, Tauhid Zaman	https://arxiv.org/abs/1810.12398	5	2018	1	mesnards-2018			augments giliani-2017 with text features	TRUE					0.91									
cresci208from	cresci	from	From Reaction to Proaction: Unexplored Ways to the Detection of Evolving Spambots	Stefano Cresci, Angelo Spognardi, Stefano Tognazz	https://dl.acm.org/doi/pdf/10.1145/3184558.3191595	32	208	0				no empirical part	TRUE	no measures reported													
dickerson2014using	dickerson	using	Using sentiment to detect bots on Twitter: Are humans more opinionated than bots?	John P. Dickerson; Vadim Kagan; V.S. Subrahmanian	https://doi.org/10.1109/ASONAM.2014.6921650		2014	0	a large dataset relating to the 2014 Indian election				TRUE					0.73									
yang2012	yang		 Analyzing Spammers’ Social Networks for Fun and Pro￿t	C. Yang, R. Harkreader, J. Zhang, S. Shin, and G. G	https://dl.acm.org/doi/pdf/10.1145/2187836.2187847?casa_token=jrptim3z0SkAAAAA:68KQtUKBbGzQ0QybdbpyDmdykkdYtmtoS74KKJ596OQ7MoGVcbKNuoJy814O0GcpDlgOcRR2ZCs		2012	0	yang-2013				TRUE	no measures reported													
bot		bot	Bot Sentinel					0	provides several datasets related to targeting Kamala Harris, recently suspended accounts, Megan Markle, and a disinfo campaign run by Project Veritas				TRUE	no measures reported													
keller2017how	keller	how	How to manipulate social media: Analyzing political astroturfing using ground truth data from South Korea.	Keller FB, Schoch D, Stier S, Yang J	https://aaai.org/ocs/index.php/ICWSM/ICWSM17/paper/view/15638		2017	0					TRUE	no measures reported													
chao2011die	chao	die	Die Free or Live Hard? Empirical Evaluation and New Design for Fighting Evolving Twitter Spammers.	Chao Yang, Robert Chandler Harkreader & Guofei Gu 	https://link.springer.com/chapter/10.1007/978-3-642-23644-0_17		2011	0	possibly spammers used in cresci-2017 or another spam dataset				TRUE				0.884					0.006		0.858			
wangdon’t	wang	don’t	Don’t Follow Me: Spam Detection in Twitter	A. Wang,	https://ieeexplore-ieee-org.libproxy.mit.edu/stamp/stamp.jsp?tp=&arnumber=5741690				wang-2009				TRUE		1	0.917	0.917										
			Uncovering Social Spammers: Social Honeypots + Machine Learning	Kyumin Lee James Caverlee Steve Webb	https://people.engr.tamu.edu/caverlee/pubs/lee10sigir.pdf								TRUE	MySpace: 0.9921 Twitter: 0.8898			MySpace: 0.992 Twitter: 0.888					MySpace: 0.007 Twitter: 0.057					
			Detecting Spammers On Social Networks	Stringhini, G., Barbara, S., Kruegel, C., Vigna, G.:	https://dl.acm.org/doi/pdf/10.1145/1920261.1920263?casa_token=ZLo6DL3Uw-IAAAAA:oJs4-p7UeG46u8rshZr6QIAblGBbsgcNU18tRygOe8V4-9lq4ZcstTJquzQ4wSAc0RH1LxVz8zo								TRUE									Facebook: 0.02 Twitter: 0.025	Facebook: 0.01 Twitter: 0.03				